?cls	?def	?xrefs
<http://purl.obolibrary.org/obo/CL_0000807>	"A thymocyte that has the phenotype CD4-negative, CD8-negative, CD44-negative, and CD25-positive and expressing the T cell receptor beta-chain in complex with the pre-T cell receptor alpha chain."	
<http://purl.obolibrary.org/obo/CL_1000085>		
<http://purl.obolibrary.org/obo/CL_1000486>	"A basal cell that is part of the urothelium."	"FMA:84150"
<http://purl.obolibrary.org/obo/CL_0000887>	"A lymph node macrophage found in the subcapsular sinus of lymph nodes that participates in sensing, clearance, and antigen presentation of lymph-borne particulate antigens. This macrophage is capable of activating invaraint NKT cells and is CD169-positive."	
<http://purl.obolibrary.org/obo/CL_2000091>	"Any microvascular endothelial cell that is part of a endometrial blood vessel."	
<http://purl.obolibrary.org/obo/CL_0002656>	"A glandular epithelial cell of the endometrium."	"FMA:86489"
<http://purl.obolibrary.org/obo/CL_0002387>	"Cylindrical spore formed by development and compartmentation of hyphae; the hyphae are often supporting blastoconidiophores."	"FAO:0000041"
<http://purl.obolibrary.org/obo/CL_0002146>	"A sweat producing cell of eccrine sweat glands. Pyramidal in shape, with its base resting on the basal lamina or myoepitheliocytes, and its microvillus-covered apical plasma membrane line up the intercellular canaliculi. Cell is not stained by hematoxylin or eosin."	"FMA:70658"
<http://purl.obolibrary.org/obo/CL_0000183>	"A cell whose primary function is to shorten."	
<http://purl.obolibrary.org/obo/CL_1000381>	"A type I vestibular sensory cell that is part of the epithelium of crista of ampulla of semicircular duct of membranous labyrinth."	"FMA:263192"
<http://purl.obolibrary.org/obo/CL_0002072>	"A specialized cardiac myocyte in the sinoatrial and atrioventricular nodes. The cell is slender and fusiform confined to the nodal center, circumferentially arranged around the nodal artery."	"FMA:67101 BTO:0004190"
<http://purl.obolibrary.org/obo/CL_0002319>	"A cell that is part of the nervous system."	"CALOHA:TS-2040 FMA:70333"
<http://purl.obolibrary.org/obo/CL_0000716>		
<http://purl.obolibrary.org/obo/CL_1000615>		"KUPO:0001024"
<http://purl.obolibrary.org/obo/CL_2000087>	"Any basket cell that is part of a dentate gyrus of hippocampal formation."	
<http://purl.obolibrary.org/obo/CL_1000282>	"A smooth muscle cell that is part of the ascending colon."	"FMA:17518"
<http://purl.obolibrary.org/obo/CL_0000345>	"A mesenchymal cell that is part of a small mass of condensed mesenchyme in the enamel organ; it differentiates into the dentin and dental pulp."	
<http://purl.obolibrary.org/obo/CL_0000235>	"A mononuclear phagocyte present in variety of tissues, typically differentiated from monocytes, capable of phagocytosing a variety of extracellular particulate material, including immune complexes, microorganisms, and dead cells."	"BTO:0000801 FMA:63261 FMA:83585 CALOHA:TS-0587"
<http://purl.obolibrary.org/obo/CL_1000359>	"A M cell that is part of the epithelium proper of appendix."	"FMA:263140"
<http://purl.obolibrary.org/obo/CL_0002460>	"A conventional thymic dendritic cell that is CD8alpha-negative."	
<http://purl.obolibrary.org/obo/CL_0002104>	"An IgG-negative double negative memory B cell is a double negative memory B cell with the phenotype IgG-negative, IgD-negative, and CD27-negative."	
<http://purl.obolibrary.org/obo/CL_1000082>		
<http://purl.obolibrary.org/obo/CL_0000866>	"A tissue-resident macrophage resident found in the thymus, involved in the clearance of apoptotic thymocytes."	
<http://purl.obolibrary.org/obo/CL_1001583>	"OBSOLETE: Adipocytes found in the subcutaneous adipose tissue of breast. The breast consists of three main components, the skin, the subcutaneous adipose tissue and the functional glandular tissue that comprises both parenchyma and stroma."	
<http://purl.obolibrary.org/obo/CL_1001516>	"the various hormone- or neurotransmitter-secreting cells present throughout the mucosa of the intestinal tract"	
<http://purl.obolibrary.org/obo/CL_0002529>	"A dermal dendritic cell that is CD1a-positive and CD14-negative."	
<http://purl.obolibrary.org/obo/CL_0002369>	"A differentiated form of a fungus produced during or as a result of an asexual or sexual reproductive process; usually a cell with a thick cell wall that stores and protects one or more nuclei. Spores may be produced in response to, and are characteristically resistant to, adverse environmental conditions."	
<http://purl.obolibrary.org/obo/CL_0002393>	"A monocyte that has characteristics of both patrolling and inflammatory monocytes."	
<http://purl.obolibrary.org/obo/CL_0000476>	"A basophil cell of the anterior pituitary that produces thyroid stimulating hormone, thyrotrophin. This cell type is elongated, polygonal and lie in clusters towards the adenohypophyseal center."	"FMA:83099"
<http://purl.obolibrary.org/obo/CL_0000368>	"Obsolete. Use PO:0000352 from Plant Ontology instead. Cell containing glucosinolates ('mustard oil glucosides') and myrosinases, enzymes hydrolyzing the glucosinolates. Occurs in eleven dicotyledon families, the two largest of which are the Brassicaceae and Euphorbiaceae."	
<http://purl.obolibrary.org/obo/CL_1000612>		"KUPO:0001021"
<http://purl.obolibrary.org/obo/CL_0000963>	"A germinal center B cell that develops from a Bm3 B cell. This cell has the phenotype IgM-negative, IgD-positive, and CD38-positive."	
<http://purl.obolibrary.org/obo/CL_0002370>	"A simple columnar epithelial cell that secretes mucin. Rough endoplasmic reticulum, mitochondria, the nucleus, and other organelles are concentrated in the basal portion. The apical plasma membrane projects microvilli to increase surface area for secretion."	
<http://purl.obolibrary.org/obo/CL_0002559>	"An animal cell that is part of a hair follicle."	
<http://purl.obolibrary.org/obo/CL_0000910>	"A mature T cell that differentiated and acquired cytotoxic function with the phenotype perforin-positive and granzyme-B positive."	"CALOHA:TS-0190 BTO:0000289 FMA:70573"
<http://purl.obolibrary.org/obo/CL_0000719>		
<http://purl.obolibrary.org/obo/CL_0002412>	"A gamma-delta receptor that expresses Vgamma1.1-Vdelta6.3 chains in the T-cell receptor."	
<http://purl.obolibrary.org/obo/CL_0000779>	"A specialized multinuclear osteoclast associated with the absorption and removal of bone."	
<http://purl.obolibrary.org/obo/CL_1000083>		
<http://purl.obolibrary.org/obo/CL_0000273>		
<http://purl.obolibrary.org/obo/CL_0002234>	"A cell of the basal layer of the epithelium in the prostatic acinus."	"FMA:74265"
<http://purl.obolibrary.org/obo/CL_0000270>	"Obsolete. Use PO:0000284 from Plant Ontology instead. An epidermal cell associated with a stoma and at least morphologically distinguishable from the epidermal cells composing the groundmass of the tissue."	
<http://purl.obolibrary.org/obo/CL_0002295>	"A thymic epithelial cell that has an eccentric, round, or irregularly shaped hetero or euchromatic nucleus. The hallmark of this cell type is the presence of vacuoles, which are clustered in one area of the cytoplasm in the vicinity of the nucleus. The vacuoles are small and acquire a grape-like form, occasionally showing delicate internal microvillous projections."	"FMA:72214"
<http://purl.obolibrary.org/obo/CL_0000358>	"A smooth muscle cell that is part of a sphincter. A sphincter is a typically circular muscle that normally maintains constriction of a natural body passage or orifice and which relaxes as required by normal physiological functioning."	
<http://purl.obolibrary.org/obo/CL_0000147>	"A pigment cell is a cell that contains pigment granules."	"VHOG:0001678"
<http://purl.obolibrary.org/obo/CL_0000989>	"CD11c-low plasmacytoid dendritic cell is a leukocyte that is CD11c-low, CD45R-positive, GR1-positive and CD11b-negative."	
<http://purl.obolibrary.org/obo/CL_0000433>	"Obsolete. Use PO:0000244 from Plant Ontology instead. In monosporic and bisporic megasporogenesis: the megaspore(s) that will undergo megagametogenesis."	
<http://purl.obolibrary.org/obo/CL_1001607>	"Chondrocyte forming the hyaline cartilage found in joints."	"CALOHA:TS-0056"
<http://purl.obolibrary.org/obo/CL_1000746>		"KUPO:0001036"
<http://purl.obolibrary.org/obo/CL_0000764>	"A immature or mature cell in the lineage leading to and including erythrocytes."	"CALOHA:TS-0290 FMA:62845 FMA:83516"
<http://purl.obolibrary.org/obo/CL_0000718>		
<http://purl.obolibrary.org/obo/CL_0000693>	"A stellate interneuron having 7-10 dendrites that may branch."	
<http://purl.obolibrary.org/obo/CL_1000483>	"A Purkinje myocyte that is part of the internodal tract."	"FMA:83392"
<http://purl.obolibrary.org/obo/CL_0002567>	"A melanocyte that appears lighter in color."	
<http://purl.obolibrary.org/obo/CL_2000068>	"Any fibroblast that is part of a pericardium."	
<http://purl.obolibrary.org/obo/CL_1001572>	"Vascular endothelium found in colon blood vessels."	"CALOHA:TS-2397"
<http://purl.obolibrary.org/obo/CL_0000185>	"Contractile cells resembling smooth muscle cells that are present in glands, notably the mammary gland, and aid in secretion. This cell has long weaving dendritic processes containing myofilament."	"BTO:0002309 FMA:67799 CALOHA:TS-2379"
<http://purl.obolibrary.org/obo/CL_0000092>	"A specialized phagocytic cell associated with the absorption and removal of the mineralized matrix of bone tissue, which typically differentiates from monocytes. This cell has the following markers: tartrate-resistant acid phosphatase type 5-positive, PU.1-positive, c-fos-positive, nuclear factor NF-kappa-B p100 subunit-positive, tumor necrosis factor receptor superfamily member 11A-positive and macrophage colony-stimulating factor 1 receptor-positive."	"FMA:66781 BTO:0000968 CALOHA:TS-0721"
<http://purl.obolibrary.org/obo/CL_0002322>	"A stem cell of embryonic origin."	"FMA:82841 CALOHA:TS-0263 BTO:0001086"
<http://purl.obolibrary.org/obo/CL_0002371>	"A cell of an organism that does not pass on its genetic material to the organism's offspring (i.e. a non-germ line cell)."	"FMA:72300 BTO:0001268 WBbt:0008378"
<http://purl.obolibrary.org/obo/CL_1000315>	"A goblet cell that is part of the epithelium of principal gastric gland."	"FMA:263040"
<http://purl.obolibrary.org/obo/CL_0000282>	"Obsolete. Use PO:0000282 from Plant Ontology instead. An outgrowth from the epidermis. Trichomes vary in size and complexity and include hairs, scales, and other structures and may be glandular. In Arabidopsis, patterning of trichome development is not random but does not appear to be lineage-based like stomata."	
<http://purl.obolibrary.org/obo/CL_0001030>		
<http://purl.obolibrary.org/obo/CL_0002117>	"A class switched memory B cell that lacks IgG on the cell surface."	
<http://purl.obolibrary.org/obo/CL_0000713>		
<http://purl.obolibrary.org/obo/CL_0000538>	"Obsolete. Use PO:0000349 from Plant Ontology instead. A relatively unspecialized cell that will give rise to specialized cell types of the epidermis."	
<http://purl.obolibrary.org/obo/CL_1000453>	"An epithelial cell that is part of the intermediate tubule."	"FMA:70980"
<http://purl.obolibrary.org/obo/CL_1000312>	"A goblet cell that is part of the epithelium of bronchus."	"FMA:263032"
<http://purl.obolibrary.org/obo/CL_0002634>	"An epithelial cell of the anal column."	
<http://purl.obolibrary.org/obo/CL_0002161>	"A cell type found on the superficial layer of the external side of the tympanic membrane. This cell-type lacks a nucleus."	
<http://purl.obolibrary.org/obo/CL_0000010>	"A cell in vitro that is or has been maintained or propagated as part of a cell culture."	
<http://purl.obolibrary.org/obo/CL_0005006>	"Specialized epithelial cells involved in the maintenance of osmotic homeostasis. They are characterized by abundant mitochondria and ion transporters. In amniotes, they are present in the renal system. In freshwater fish, ionocytes in the skin and gills help maintain osmotic homeostasis by absorbing salt from the external environment."	
<http://purl.obolibrary.org/obo/CL_0002167>	"A specialized cell involved in sensory perception of smell."	"FMA:67870"
<http://purl.obolibrary.org/obo/CL_0000688>	"A fibroblast-like cell that provides support at neuromuscular junctions in vertebrates and are localized outside the synaptic basal lamina."	
<http://purl.obolibrary.org/obo/CL_0000051>	"A oligopotent progenitor cell committed to the lymphoid lineage."	
<http://purl.obolibrary.org/obo/CL_0002519>	"An interrenal epithelial kidney cell is an epithelial cell found in the anterior kidney of teleosts fish. This cell type is arranged in layers around the posterior cardinal vein and contains many mitochondria with tubulovesicular cristae. Interrenal chromaffin cells are interspersed among the tissue layer created by this cell type."	
<http://purl.obolibrary.org/obo/CL_0000409>		"FBbt:00005219"
<http://purl.obolibrary.org/obo/CL_0000712>		
<http://purl.obolibrary.org/obo/CL_0000158>	"Epithelial progenitor cell of the lung. Club cells are dome-shaped with short microvilli but no cilia. They function to protect the bronchiolar epithelium. Club cells also multiply and differentiate into ciliated cells to regenerate the bronchiolar epithelium."	"BTO:0004811 FMA:14119"
<http://purl.obolibrary.org/obo/CL_2000048>	"Any spinal cord motor neuron that is part of a ventral horn of spinal cord."	
<http://purl.obolibrary.org/obo/CL_0002253>	"An epithelial cell of the large intestine."	"BTO:0004297 FMA:256157"
<http://purl.obolibrary.org/obo/CL_0000594>	"An elongated, spindle-shaped, cell that is located between the basal lamina and the plasmalemma of a muscle fiber. These cells are mostly quiescent, but upon activation they divide to produce cells that generate new muscle fibers."	
<http://purl.obolibrary.org/obo/CL_0002272>	"A cell that secretes motilin, a gastric hormone that at low pH inhibits gastric motor activity, whereas at high pH has a stimulating effect."	
<http://purl.obolibrary.org/obo/CL_1000447>	"A basal cell that is part of the epithelium of esophagus."	"FMA:70731"
<http://purl.obolibrary.org/obo/CL_0002514>	"A CD8alpha alpha positive gamma-delta intraepithelial T cell that does not express a TCR partially encoded by the Vgamma5 gene segment."	
<http://purl.obolibrary.org/obo/CL_0002433>	"A CD4-positive, CD8-negative thymocyte that expresses high levels of the alpha-beta T cell receptor and is CD69-positive."	
<http://purl.obolibrary.org/obo/CL_1001509>	"the neurons that utilize glycine as a neurotransmitter"	
<http://purl.obolibrary.org/obo/CL_0000586>	"The reproductive cell in multicellular organisms."	"WBbt:0006796 VHOG:0001534 BTO:0000535"
<http://purl.obolibrary.org/obo/CL_0000921>	"An alpha-beta T cell expressing NK cell markers that is CD1d restricted and expresses specific V-alpha chains. NK T cells of this type recognize the glycolipid alpha-galactosylceramide in the context of CD1d."	
<http://purl.obolibrary.org/obo/CL_0000911>	"A differentiated T cell with ability to traffic to peripheral tissues and is capable of mounting a specific immune response."	
<http://purl.obolibrary.org/obo/CL_0011100>	"Neuron that secretes the neurotransmitter galanin."	
<http://purl.obolibrary.org/obo/CL_0009001>	"Any cell in the compound eye, a light sensing organ composed of ommatidia."	"PMID:12021768 GOC:pr"
<http://purl.obolibrary.org/obo/CL_0000951>	"A short lived plasma cell that secretes IgE."	
<http://purl.obolibrary.org/obo/CL_0000278>	"Obsolete. Use PO:0020090 from Plant Ontology instead. OBSOLETED, use term from Plant Ontology. A cell containing the two polar nuclei which, after double fertilization, will develop into the endosperm."	
<http://purl.obolibrary.org/obo/CL_0000458>	"A cell type that secretes 5-Hydroxytryptamine (serotonin)."	
<http://purl.obolibrary.org/obo/CL_1000346>	"MERGED DEFINITION: TARGET DEFINITION: A columnar cell of the colon that is part of the epithelium proper of large intestine. SOURCE DEFINITION: An enterocyte that is part of the epithelium proper of large intestine."	"FMA:263112 FMA:263090"
<http://purl.obolibrary.org/obo/CL_1000291>	"A muscle cell that is part of the posterior internodal tract."	"FMA:223280"
<http://purl.obolibrary.org/obo/CL_0000715>		
<http://purl.obolibrary.org/obo/CL_0001022>	"CD115-positive monocyte is a monocyte that is CD115-positive and CD11b-positive."	
<http://purl.obolibrary.org/obo/CL_0000050>	"A progenitor cell committed to the megakaryocyte and erythroid lineages."	
<http://purl.obolibrary.org/obo/CL_0001044>	"A CD4-positive, alpha-beta T cell with the phenotype CCR7-negative, CD45RA-positive."	
<http://purl.obolibrary.org/obo/CL_0002581>		
<http://purl.obolibrary.org/obo/CL_0000021>	"Female germ cell is a germ cell that supports female gamete production."	"MA:0000388 ncithesaurus:Egg VHOG:0001530"
<http://purl.obolibrary.org/obo/CL_0002564>	"A connective tissue cell of the nucleus pulposus cell of intervertebral disc."	
<http://purl.obolibrary.org/obo/CL_0002043>	"A hematopoietic multipotent progenitor cell that is CD34-positive, CD38-negative, CD45RA-negative, and CD90-negative."	
<http://purl.obolibrary.org/obo/CL_0000875>	"A type of monocyte characterized by low expression of CCR2, low responsiveness to monocyte chemoattractant CCL2/MCP1, low phagocytic activity, and decrease size relative to classical monocytes, but increased co-stimulatory activity. May also play a role in tissue repair."	
<http://purl.obolibrary.org/obo/CL_0002473>	"Gr1-low non-classical monocyte that has high surface expression of a MHC-II complex."	
<http://purl.obolibrary.org/obo/CL_0002500>	"A P/D1 enteroendocrine cell that is Grimelius positive and stores bombesin-like polypeptide."	
<http://purl.obolibrary.org/obo/CL_0000042>	"A myeloblast committed to the neutrophil lineage. This cell type is GATA-1 positive, C/EBPa-positive, AML-1-positive, c-myb-positive and has low expression of PU.1 transcription factor."	
<http://purl.obolibrary.org/obo/CL_0000243>	"A non-neuronal cell of the nervous system. They not only provide physical support, but also respond to injury, regulate the ionic and chemical composition of the extracellular milieu. Form the myelin insulation of nervous pathways, guide neuronal migration during development, and exchange metabolites with neurons. Neuroglia have high-affinity transmitter uptake systems, voltage-dependent and transmitter-gated ion channels, and can release transmitters, but their role in signaling (as in many other functions) is unclear."	
<http://purl.obolibrary.org/obo/CL_0002563>	"An epithelial cell of the intestine."	
<http://purl.obolibrary.org/obo/CL_0002674>	"A S. pombe mating type determined by the mat1-Mc and mat1-Mi on the mat1 locus."	
<http://purl.obolibrary.org/obo/CL_0000745>	"A neuron that laterally connects other neurons in the inner nuclear layer of the retina."	"BTO:0004120"
<http://purl.obolibrary.org/obo/CL_0002313>	"An ecto-epithelial cell of the prostate gland that secretes hormones."	"FMA:74390 FMA:86774 CALOHA:TS-1280"
<http://purl.obolibrary.org/obo/CL_0002642>	"An epithelial cell of the esophageal cardiac gland that occurs both in the proximal and distal esophagus, within the lamina propia."	"FMA:256143"
<http://purl.obolibrary.org/obo/CL_0001020>	"Mature CD8_alpha-low Langerhans cell is a CD8_alpha-low Langerhans cell that that is CD80-high, CD86-high, MHCII-high and is CD83-positive."	
<http://purl.obolibrary.org/obo/CL_0002435>	"A CD4-positive, CD8-negative thymocyte that expresses high levels of the alpha-beta T cell receptor and is CD69-positive."	
<http://purl.obolibrary.org/obo/CL_1000379>	"A type I vestibular sensory cell that is part of the epithelium of macula of utricle of membranous labyrinth."	"FMA:263188"
<http://purl.obolibrary.org/obo/CL_0002666>	"An otic fibrocyte that underlies the spiral prominence and is part of a mesenchymal gap junction network that regulates ionic homeostasis of the endolymph."	
<http://purl.obolibrary.org/obo/CL_0000979>	"An IgG memory B cell is a class switched memory B cell that is class switched and expresses IgG on the cell surface."	
<http://purl.obolibrary.org/obo/CL_0000972>	"A class switched memory B cell is a memory B cell that has undergone Ig class switching and therefore is IgM-negative on the cell surface. These cells are CD27-positive and have either IgG, IgE, or IgA on the cell surface."	
<http://purl.obolibrary.org/obo/CL_0000377>		
<http://purl.obolibrary.org/obo/CL_0000824>	"A natural killer cell that is developmentally mature and expresses a variety of inhibitory and activating receptors that recognize MHC class I and other stress related molecules."	
<http://purl.obolibrary.org/obo/CL_0000511>	"A peptide hormone secreting cell that secretes androgen binding protein."	
<http://purl.obolibrary.org/obo/CL_0000159>		
<http://purl.obolibrary.org/obo/CL_1000274>		
<http://purl.obolibrary.org/obo/CL_0000462>		"FBbt:00003219"
<http://purl.obolibrary.org/obo/CL_0002381>	"A conidium that has only one nucleus."	"FAO:0000025"
<http://purl.obolibrary.org/obo/CL_2000088>	"Any basket cell that is part of a Ammon's horn."	
<http://purl.obolibrary.org/obo/CL_1000804>		"KUPO:0001094"
<http://purl.obolibrary.org/obo/CL_1001036>		"KUPO:0001068"
<http://purl.obolibrary.org/obo/CL_1000719>		"KUPO:0001135"
<http://purl.obolibrary.org/obo/CL_0002374>	"A hair cell of the ear that contains the organs of balance and hearing."	
<http://purl.obolibrary.org/obo/CL_0002445>	"A NK1.1-positive T cell that is Ly49D-negative."	
<http://purl.obolibrary.org/obo/CL_0002299>	"An epithelial cell scattered in the cortex, predominant in the outer cortex with a large pale nucleus and a prominent nucleolus."	"FMA:72210"
<http://purl.obolibrary.org/obo/CL_0000412>	"A cell whose nucleus, or nuclei, each contain more than two haploid genomes."	
<http://purl.obolibrary.org/obo/CL_0001007>	"Interstitial dendritic cell is a conventional dendritic cell that is CD11b-positive, CD1a-positive, CD206-positive, CD209-positive, and CD36-positive."	
<http://purl.obolibrary.org/obo/CL_0000677>	"Cell of the intestinal epithelium with a brush border made up of many parallel packed microvilli; associated with absorption, particularly of macromolecules."	
<http://purl.obolibrary.org/obo/CL_0000376>		
<http://purl.obolibrary.org/obo/CL_0000110>		
<http://purl.obolibrary.org/obo/CL_0002095>	"A cell in the hilum of the ovary that produces androgens."	"FMA:18710"
<http://purl.obolibrary.org/obo/CL_1000410>	"A muscle cell that is part of the atrioventricular node."	"FMA:67106"
<http://purl.obolibrary.org/obo/CL_0002592>	"A smooth muscle cell of the coronary artery."	
<http://purl.obolibrary.org/obo/CL_0000098>	"A specialized epithelial cell involved in sensory perception. Restricted to special sense organs of the olfactory, gustatory, and vestibulocochlear receptor systems; contain sensory cells surrounded by supportive, non-receptive cells."	"BTO:0004301"
<http://purl.obolibrary.org/obo/CL_0000909>	"A CD8-positive, alpha-beta T cell with memory phenotype indicated by being CD45RO and CD127-positive. This cell type is also described as being CD25-negative, CD44-high, and CD122-high."	
<http://purl.obolibrary.org/obo/CL_0002052>	"A pre-B cell that is pre-BCR-negative, and the kappa- and lambda- light immunoglobulin light chain-negative, CD43-low, and is BP-1-positive, CD45R-positive and CD25-positive. This cell type is also described as being AA4-positive, IgM-negative, CD19-positive, CD43-low/negative, and HSA-positive."	
<http://purl.obolibrary.org/obo/CL_1000375>	"A myocardial endocrine cell that is part of the septal division of left branch of atrioventricular bundle."	"FMA:263180"
<http://purl.obolibrary.org/obo/CL_0002106>	"An IgD-positive CD38-positive IgG memory B cell is a CD38-positive IgG-positive class switched memory B cell that has class switched and expresses IgD on the cell surface with the phenotype IgD-positive, CD38-positive, and IgG-positive."	
<http://purl.obolibrary.org/obo/CL_1000272>		
<http://purl.obolibrary.org/obo/CL_0002237>	"A cell that constitutes the luminal layer of epithelium of prostatic duct."	"FMA:74225"
<http://purl.obolibrary.org/obo/CL_1000444>	"A mesothelial cell that is part of the anterior chamber of eyeball."	"FMA:70615"
<http://purl.obolibrary.org/obo/CL_0001042>	"CD4-positive, alpha-beta T cell that produces IL-22."	
<http://purl.obolibrary.org/obo/CL_0000246>		
<http://purl.obolibrary.org/obo/CL_0002645>	"An endocranial viscerocranial mucosa cell that is part of viscerocranial mucosa."	"FMA:70629"
<http://purl.obolibrary.org/obo/CL_0000028>		
<http://purl.obolibrary.org/obo/CL_0000379>		
<http://purl.obolibrary.org/obo/CL_0000434>	"A secretory cell that discharges its product without loss of cytoplasm."	
<http://purl.obolibrary.org/obo/CL_0000077>	"A flattened epithelial cell of mesenchymal origin that lines the serous cavity."	"FMA:66773"
<http://purl.obolibrary.org/obo/CL_0002315>	"An epithelial supporting cell located in the cochlea."	"FMA:79796"
<http://purl.obolibrary.org/obo/CL_0002083>	"A chromaffin cell of the adrenal medulla that produces norepinephrine."	"FMA:69321"
<http://purl.obolibrary.org/obo/CL_0007009>	"Skeletogenic cell that has the potential to develop into a chondroblast; and arises from neural crest, meseosdermal and notochordal and connective tissue cells."	
<http://purl.obolibrary.org/obo/CL_1000717>		"KUPO:0001133"
