?cls	?def	?xrefs
<http://purl.obolibrary.org/obo/CL_0002537>	"A mesenchymal stem cell of the amnion membrane."	
<http://purl.obolibrary.org/obo/CL_0002129>	"Regular cardiac myocyte of a cardiac atrium."	"FMA:83108"
<http://purl.obolibrary.org/obo/CL_0002312>	"An acidophilic cell of the anterior pituitary that produces growth hormone, somatotropin."	"FMA:83095"
<http://purl.obolibrary.org/obo/CL_0002413>	"A Vgamma1.1-positive, Vdelta6.3-negative thymocyte that is CD24-negative."	
<http://purl.obolibrary.org/obo/CL_0000353>	"An undifferentiated cell produced by early cleavages of the fertilized egg (zygote)."	"FMA:72551 BTO:0001473"
<http://purl.obolibrary.org/obo/CL_0000305>	"OBSOLETE (was not defined before being made obsolete)."	
<http://purl.obolibrary.org/obo/CL_0001050>	"A CD8-positive, alpha-beta T cell with the phenotype CCR7-negative, CD45RA-positive."	
<http://purl.obolibrary.org/obo/CL_0000430>	"A pigment cell derived from the neural crest. Contains cartenoid pigments in structures called pterinosomes or xanthosomes. This gives an appearance ranging from a golden yellow to orange and red."	
<http://purl.obolibrary.org/obo/CL_0000063>	"OBSOLETE: A classification of cells by their microscopic appearance."	
<http://purl.obolibrary.org/obo/CL_0000389>		
<http://purl.obolibrary.org/obo/CL_0000256>		
<http://purl.obolibrary.org/obo/CL_0000341>		
<http://purl.obolibrary.org/obo/CL_0000473>	"A cell whose primary function is to protect the organism."	
<http://purl.obolibrary.org/obo/CL_0000123>		
<http://purl.obolibrary.org/obo/CL_0001016>	"Immature CD1a-positive Langerhans cell is a CD1a-positive Langerhans cell that is CD80-low, CD86-low, and MHCII-low."	
<http://purl.obolibrary.org/obo/CL_0000419>	"An epithelial fate stem cell found in flatworms."	"BTO:0003039"
<http://purl.obolibrary.org/obo/CL_0002205>	"A brush cell found in the epithelium of lobular bronchiole."	"FMA:263220"
<http://purl.obolibrary.org/obo/CL_0000260>	"Obsolete. Use PO:0000373 from Plant Ontology instead. Cell containing mucilages or gums or similar carbohydrate material characterized by the property of swelling in water."	
<http://purl.obolibrary.org/obo/CL_0000667>	"An extracellular matrix secreting cell that secretes collagen."	
<http://purl.obolibrary.org/obo/CL_0000626>	"Granule cell that is part of the olfactory bulb."	
<http://purl.obolibrary.org/obo/CL_1000305>	"A fibroblast that is part of the connective tissue of glandular part of prostate."	"FMA:261283"
<http://purl.obolibrary.org/obo/CL_0000449>	"A cell from the thermogenic form of adipose tissue found in many species,  particularly in newborns and hibernating mammals, but also in lesser amounts in adults of other mammals including humans. Brown fat is capable of rapid liberation of energy and seems to be important in the maintenance of body temperature immediately after birth and upon waking from hibernation."	"FMA:83435 CALOHA:TS-0099"
<http://purl.obolibrary.org/obo/CL_0000685>	"Obsolete. Use PO:0004010 from Plant Ontology instead. A cell synthesizing protoplasm and producing new cells by division and with only a primary cell wall."	
<http://purl.obolibrary.org/obo/CL_0000290>	"Obsolete. Use PO:0000274 from Plant Ontology instead. A fiber of the xylem tissue, Two types are recognized in the secondary xylem: fiber tracheids and libriform fibers."	
<http://purl.obolibrary.org/obo/CL_0000164>	"An endocrine cell that is located in the epithelium of the gastrointestinal tract or in the pancreas."	"FMA:62930 BTO:0003865"
<http://purl.obolibrary.org/obo/CL_0002035>	"A hematopoietic progenitor that has restricted self-renewal capability. Cell is Kit-positive, Ly6-positive, CD150-negative and Flt3-negative."	
<http://purl.obolibrary.org/obo/CL_0001010>	"Mature dermal dendritic cell is a dermal dendritic cell that is CD80-high, CD86-high, MHCII-high and is CD83-positive."	
<http://purl.obolibrary.org/obo/CL_0000370>	"Obsolete. Use PO:0000078 from Plant Ontology instead. Parenchyma cell with the wall ingrowth (or invaginations) that increase the surface of the plasmalemma. Appears to be specialized for short-distance transfer of solutes."	
<http://purl.obolibrary.org/obo/CL_0000691>		
<http://purl.obolibrary.org/obo/CL_0000657>	"One of the two haploid cells into which a primary spermatocyte divides, and which in turn gives origin to spermatids."	"BTO:0000709 FMA:72293 CALOHA:TS-2195 FBbt:00004941"
<http://purl.obolibrary.org/obo/CL_0000304>	"OBSOLETE (was not defined before being made obsolete)."	
<http://purl.obolibrary.org/obo/CL_0002199>	"An oncocyte located in the parathyroid gland."	"FMA:69084"
<http://purl.obolibrary.org/obo/CL_0002000>	"An erythroid progenitor cell is Kit-positive, Ly6A-negative, CD41-negative, CD127-negative, and CD123-negative. This cell type is also described as being lin-negative, Kit-positive, CD150-negative, CD41-negative, CD105-positive, and FcgR-negative."	
<http://purl.obolibrary.org/obo/CL_0002125>	"A circulating gamma-delta T cell that expresses RORgamma(t), is CD27-negative and is capable of IL-17 secretion."	
<http://purl.obolibrary.org/obo/CL_0005023>	"Cranial motor neuron which innervates muscles derived from the branchial (pharyngeal) arches."	"PMID:14699587"
<http://purl.obolibrary.org/obo/CL_1000490>	"A mesothelial cell that is part of the peritoneum."	"FMA:86736"
<http://purl.obolibrary.org/obo/CL_0000340>		
<http://purl.obolibrary.org/obo/CL_0000255>		
<http://purl.obolibrary.org/obo/CL_0002487>	"A neuronal receptor that respond to mechanical pressure or distortion in the skin."	
<http://purl.obolibrary.org/obo/CL_0000122>		"BTO:0002316"
<http://purl.obolibrary.org/obo/CL_0002202>	"An epithelial cell of the tracheobronchial tree."	"FMA:66816"
<http://purl.obolibrary.org/obo/CL_0002063>	"A type II pneumocyte is a pneumocyte that modulates the fluid surrounding the alveolar epithelium by secreting and recycling surfactants. This cell type also contributes to tissue repair and can differentiate after injury into a type I pneumocyte. Thicker than squamous alveolar cells, have a rounded apical surface that projects above the level of surrounding epithelium. The free surface is covered by short microvilli."	"BTO:0000538 FMA:62501"
<http://purl.obolibrary.org/obo/CL_2000097>	"Any dopaminergic neuron that is part of a midbrain."	
<http://purl.obolibrary.org/obo/CL_0002218>	"A double negative thymocyte that has a T cell receptor consisting of a gamma chain that has as part a Vgamma3 segment, and a delta chain. This cell type is CD4- negative, CD8-negative and CD24-positive. This cell-type is found in the fetal thymus with highest numbers occurring at E17-E18."	
<http://purl.obolibrary.org/obo/CL_0000478>	"A peptide hormone secreting cell that secretes oxytocin stimulating hormone"	
<http://purl.obolibrary.org/obo/CL_0000106>	"Neuron with one neurite that extends from the cell body."	"FMA:67278"
<http://purl.obolibrary.org/obo/CL_1000301>	"A fibroblast that is part of the subepithelial connective tissue of prostatic gland."	"FMA:261275"
<http://purl.obolibrary.org/obo/CL_0002105>	"A CD38-positive IgG memory B cell is a class switched memory B cell that expresses IgG on the cell surface with the phenotype CD38-positive and IgG-positive."	
<http://purl.obolibrary.org/obo/CL_0010013>		
<http://purl.obolibrary.org/obo/CL_0000607>	"A thick walled spore that stores and protects one or more nuclei following sexual reproduction in an Ascomycete."	"FAO:0000020 BTO:0000097"
<http://purl.obolibrary.org/obo/CL_0002283>	"An epithelial cell of the mucosa associated with facial skeleton."	"FMA:70581"
<http://purl.obolibrary.org/obo/CL_0002099>	"A small, polyhedral, cell found in rounded groups or curved columns with deeply staining nuclei, scanty basophilic cytoplasm and a few lipid droplets. This cell in the zona glomerulosa produces mineralocorticoids."	"FMA:69273"
<http://purl.obolibrary.org/obo/CL_2000031>	"Any neuron that is part of a lateral line ganglion."	
<http://purl.obolibrary.org/obo/CL_0000694>		
<http://purl.obolibrary.org/obo/CL_1000349>	"A basal cell found in the bronchus epithelium."	"FMA:263120"
<http://purl.obolibrary.org/obo/CL_0002441>	"A NK1.1-positive T cell that is CD94-positive."	
<http://purl.obolibrary.org/obo/CL_0002628>	"An immature microglial cell with a ramified morphology."	
<http://purl.obolibrary.org/obo/CL_0002050>	"A pre-BCR-positive precursor B cell that is CD24-high, CD25-positive, CD43-positive, CD45R-positive and BP-positive."	
<http://purl.obolibrary.org/obo/CL_0002461>	"A conventional dendritic cell that is CD103-positive. This cell type is usually found in non-lymphoid tissue."	
<http://purl.obolibrary.org/obo/CL_0002294>	"An epithelial cell with a well defined Golgi apparatus that makes up the continuous layer of cells bordering the thymic tissue beneath the capsule."	"FMA:72209"
<http://purl.obolibrary.org/obo/CL_0010014>		
<http://purl.obolibrary.org/obo/CL_0011012>	"A cell of the neural crest. Neural crest cells are multipotent. Premigratory neural crest cells are found at the neural plate boarder, some of which will undergo ectomesynchymal transition and delamination to form migratory neural crest cells."	
<http://purl.obolibrary.org/obo/CL_1001131>		"KUPO:0001074"
<http://purl.obolibrary.org/obo/CL_0000978>	"A short lived plasma cell that secretes IgM."	
<http://purl.obolibrary.org/obo/CL_0000557>	"A hematopoietic progenitor cell that is committed to the granulocyte and monocyte lineages. These cells are CD123-positive, and do not express Gata1 or Gata2 but do express C/EBPa, and Pu.1."	
<http://purl.obolibrary.org/obo/CL_0000623>	"A lymphocyte that can spontaneously kill a variety of target cells without prior antigenic activation via germline encoded activation receptors and also regulate immune responses via cytokine release and direct contact with other cells."	"FMA:83601 FMA:63147 BTO:0004716 VHOG:0001697 BTO:0000914 CALOHA:TS-0664"
<http://purl.obolibrary.org/obo/CL_0000973>	"A class switched memory B cell that expresses IgA."	
<http://purl.obolibrary.org/obo/CL_0000832>	"A myeloblast committed to the eosinophil lineage."	
<http://purl.obolibrary.org/obo/CL_0000206>	"A cell specialized to detect chemical substances and relay that information centrally in the nervous system. Chemoreceptors may monitor external stimuli, as in taste and olfaction, or internal stimuli, such as the concentrations of oxygen and carbon dioxide in the blood."	
<http://purl.obolibrary.org/obo/CL_2000056>	"Any pyramidal cell that is part of a regional part of cerebral cortex."	
<http://purl.obolibrary.org/obo/CL_0000257>		
<http://purl.obolibrary.org/obo/CL_0000124>		"FBbt:00005144"
<http://purl.obolibrary.org/obo/CL_0002474>	"A MHC-II-negative classical monocyte located in lymphoid tissue that is F4/80-positive, CD11c-negative, and CD11b-high."	
<http://purl.obolibrary.org/obo/CL_0000564>	"A promyelocyte committed to the neutrophil lineage. This cell type is GATA-1-positive, C/EBPa-positive, AML-1-positive, MPO-positive, has low expression of PU.1 transcription factor and lacks lactotransferrin expression."	"FMA:84196"
<http://purl.obolibrary.org/obo/CL_0000593>	"A steroid hormone secreting cell that secretes androgen."	
<http://purl.obolibrary.org/obo/CL_0000889>	"An immature myeloid leukocyte of heterogeneous phenotype found particularly in cancer and sepsis patients that is capable of suppressing activity of T cells in ex vivo assays. This cell type is CD45-positive, CD11b-positive."	
<http://purl.obolibrary.org/obo/CL_0011007>	"A cell in the area of mesoderm in the neurulating embryo that flanks and forms simultaneously with the neural tube. The cells of this region give rise to somites."	
<http://purl.obolibrary.org/obo/CL_0002450>	"A specialized hair cell that has an elongated kinocilium upon which an otolith accretes. The tether cell then anchors the otolith in place."	
<http://purl.obolibrary.org/obo/CL_0001019>		
<http://purl.obolibrary.org/obo/CL_0002118>	"A CD38-negative IgG-negative memory B cell is a IgG-negative class switched memory B cell that lacks IgG on the cell surface with the phenotype CD38-negative and IgG-negative."	
<http://purl.obolibrary.org/obo/CL_0002053>	"A small pre-B cell that is CD22-positive and CD38-low."	
<http://purl.obolibrary.org/obo/CL_0002292>	"A round or oval neuroepithelial cell that contacts other type I cells or capillaries. They occur in clusters that are surrounded by sheath cells (type-II cells) in the carotid body. This cell type is capable of secreting a number of neurotransmitters."	"FMA:84186"
<http://purl.obolibrary.org/obo/CL_0011115>	"A cell that, by division or terminal differentiation, can give rise to other cell types."	
<http://purl.obolibrary.org/obo/CL_0002572>	"A mesenchymal stem cell of the vertebrae."	
<http://purl.obolibrary.org/obo/CL_0002655>	"An epithelial cell of stratum spinosum of esophageal epithelium."	"FMA:70732"
<http://purl.obolibrary.org/obo/CL_0002132>	"A stomal cell of the ovary"	"FMA:72299"
<http://purl.obolibrary.org/obo/CL_0000470>		
<http://purl.obolibrary.org/obo/CL_0002200>	"An oncocyte located in the thyroid."	"FMA:87169"
<http://purl.obolibrary.org/obo/CL_0002606>	"An astrocyte of the spinal cord."	
<http://purl.obolibrary.org/obo/CL_2000034>	"Any neuromast hair cell that is part of a anterior lateral line."	
<http://purl.obolibrary.org/obo/CL_0000385>		"FBbt:00005062"
<http://purl.obolibrary.org/obo/CL_0000167>		
<http://purl.obolibrary.org/obo/CL_0002640>	"An epithelial fate stem cell derived form the amnion membrane."	
<http://purl.obolibrary.org/obo/CL_1000352>	"A basal cell that is part of the epithelium of bronchiole."	"FMA:263126"
<http://purl.obolibrary.org/obo/CL_0002032>	"A hematopoietic oligopotent progenitor cell that has the ability to differentiate into limited cell types but lacks lineage cell markers and self renewal capabilities. Cell lacks hematopoeitic lineage markers."	
<http://purl.obolibrary.org/obo/CL_0000942>	"A plasmacytoid dendritic cell developing in the thymus with phenotype CD11c-negative or low, CD45RA-positive, CD11b-negative, and CD123-positive."	
<http://purl.obolibrary.org/obo/CL_0010016>	"A cell with a flagellum surrounded by a collar of microvilli. The motion of the flagellum draws water past the microvilli, serving either a feeding or sensory function. Collar cells are found in multiple animals, including sponges, echinoderms, and cnidarians. They are also found outside animals in the choanoflagellates. Although collar cells are superficially similar, their cytoskeletal structure and functional biology are different in different groups of organisms."	
<http://purl.obolibrary.org/obo/CL_0002456>	"A CD11c-low plasmacytoid dendritic cell that is CD8alpha-positive and CD4-positive."	
<http://purl.obolibrary.org/obo/CL_0002352>	"A hematopoietic stem cell that exists during embryogenesis."	
<http://purl.obolibrary.org/obo/CL_1000448>	"An epithelial cell that is part of the sweat gland."	"FMA:70952"
<http://purl.obolibrary.org/obo/CL_0000182>	"The main structural component of the liver. They are specialized epithelial cells that are organized into interconnected plates called lobules. Majority of cell population of liver, polygonal in shape, arranged in plates or trabeculae between sinusoids; may have single nucleus or binucleated."	"BTO:0000575 CALOHA:TS-0454 FMA:14515"
<http://purl.obolibrary.org/obo/CL_0000251>		
<http://purl.obolibrary.org/obo/CL_0007002>	"Skeletogenic cell that has the potential to develop into a cementoblast."	
<http://purl.obolibrary.org/obo/CL_0000057>	"A connective tissue cell which secretes an extracellular matrix rich in collagen and other macromolecules. Flattened and irregular in outline with branching processes; appear fusiform or spindle-shaped."	"BTO:0000452 VHOG:0001482 FMA:63877 CALOHA:TS-0362"
<http://purl.obolibrary.org/obo/CL_0000384>		
<http://purl.obolibrary.org/obo/CL_1001517>	"the various hormone- or neurotransmitter-secreting cells present throughout the mucosa of the stomach"	
<http://purl.obolibrary.org/obo/CL_0002251>	"An epithelial cell of the musculomembranous digestive tube extending from the mouth to the anus."	
<http://purl.obolibrary.org/obo/CL_1000333>	"A serous secreting cell that is part of the epithelium of bronchiole."	"FMA:263084"
<http://purl.obolibrary.org/obo/CL_0012000>	"An astrocyte of the forebrain."	
<http://purl.obolibrary.org/obo/CL_1000310>	"A fat cell that is part of the epicardial fat of right ventricle."	"FMA:261297"
<http://purl.obolibrary.org/obo/CL_1000468>	"A myoepithelial cell that is part of the acinus of lactiferous gland."	"FMA:74469"
<http://purl.obolibrary.org/obo/CL_0000190>	"A muscle cell that can develop high tension rapidly. It is usually innervated by a single alpha neuron ."	
<http://purl.obolibrary.org/obo/CL_0002496>	"A T cell that is located in the intestinal epithelium and is capable of a mucosal immune response."	
<http://purl.obolibrary.org/obo/CL_0000750>	"A bipolar neuron found in the retina and having connections with photoreceptors cells and neurons in the outer half of the inner plexiform layer. These cells depolatize in response to light to dark transition."	
<http://purl.obolibrary.org/obo/CL_0000232>	"A red blood cell. In mammals, mature erythrocytes are biconcave disks containing hemoglobin whose function is to transport oxygen."	"CALOHA:TS-0290 FMA:81100 BTO:0000424"
<http://purl.obolibrary.org/obo/CL_0002023>	"A megakaroycotye progenitor cell that is CD34-positive, CD41-positive and CD42-positive on the cell surface."	
<http://purl.obolibrary.org/obo/CL_0002661>	"A luminal cell of terminal ducts, i.e.e the terminal branch of a lactiferous duct which alveolar cells drain into."	"FMA:87168"
<http://purl.obolibrary.org/obo/CL_0000211>	"A cell whose function is determined by the generation or the reception of an electric signal."	
<http://purl.obolibrary.org/obo/CL_0000648>	"A smooth muscle cell that synthesizes, stores, and secretes the enzyme renin. This cell type are located in the wall of the afferent arteriole at the entrance to the glomerulus. While having a different origin than other kidney smooth muscle cells, this cell type expresses smooth muscle actin upon maturation."	"FMA:84138"
<http://purl.obolibrary.org/obo/CL_1001045>		"KUPO:0001077"
<http://purl.obolibrary.org/obo/CL_0002438>	"A mature NK cell that is NK1.1-positive."	
<http://purl.obolibrary.org/obo/CL_0000646>	"Undifferentiated; mitotic stem cell for other epithelial cell types; rounded or elliptical with little cytoplasm and few organelles; contain cytokeratin intermediate filament."	"FMA:62516 BTO:0000939"
<http://purl.obolibrary.org/obo/CL_0000840>	"An immature cell of the conventional dendritic cell lineage, characterized by high levels of antigen uptake via endocytosis, macropinocytosis, and phagocytosis, and typically found resident in the tissues. Markers for this cell are CD80-low, CD86-low, and MHC-II-low."	
<http://purl.obolibrary.org/obo/CL_0000116>	"Pioneer neurons establish a pathway in the developing central nervous system and then undergo programmed cell death once the adult axons, which follow them, have made connections with the target site. Thus, they are a transient cell type involved in axon guidance."	"FBbt:00005128"
<http://purl.obolibrary.org/obo/CL_0000770>	"A late basophilic metamyelocyte in which the nucleus is in the form of a curved or coiled band, not having acquired the typical multilobar shape of the mature basophil."	
<http://purl.obolibrary.org/obo/CL_0002646>	"An ecto-epithelial cell of the buccal region of the viscerocranial mucosa."	"FMA:70577"
<http://purl.obolibrary.org/obo/CL_2000004>	"Any cell that is part of a pituitary gland."	
<http://purl.obolibrary.org/obo/CL_0002284>	"An enteroendorcine cell found in the fundus and pylorus, this cell type has dense round secretory granules that contain ghrelin."	"FMA:63209"
<http://purl.obolibrary.org/obo/CL_0002300>	"A small medullary thymic epithelial cell with a spindle shape, often arranged in groups and connected to each other by large desmosomes and interdigitations. The cytoplasm is sparse, with scanty organelles and thick bundles of cytokeratin."	
<http://purl.obolibrary.org/obo/CL_0001025>	"A common lymphoid progenitor that is Kit-low, FLT3-positive, IL7ralpha-positive, and SCA1-low."	
<http://purl.obolibrary.org/obo/CL_0000690>		
<http://purl.obolibrary.org/obo/CL_2000070>	"Any fibroblast that is part of a optic choroid."	
<http://purl.obolibrary.org/obo/CL_1000442>	"An urothelial cell that is part of the trigone of urinary bladder."	"FMA:70598"
<http://purl.obolibrary.org/obo/CL_1001610>	"Hematopoietic cells resident in the bone marrow. Include: hematopoietic stem cells (lymphoid stem cells and myeloid stem cells) and the precursor cells for thrombocytes, erythrocytes, basophils, neutrophils, eosinophils, monocytes and lymphocytes."	"CALOHA:TS-2109"
<http://purl.obolibrary.org/obo/CL_0000036>		
<http://purl.obolibrary.org/obo/CL_0000330>	"Obsolete. Use PO:0000075 from Plant Ontology instead. An elongated living cell with unevenly thickened nonlignified primary walls."	
<http://purl.obolibrary.org/obo/CL_0000411>	"An epithelial cell of the hypodermis of flatworms."	"WBbt:0007846"
<http://purl.obolibrary.org/obo/CL_1001598>	"A glandular cell found in the epithelium of the small intestine. Example: Enterocytes, Goblet cells, enteroendocrine cells; Paneth cells; M cells; Somatostatin-secreting Cells (D-cells) ."	"CALOHA:TS-1286 FMA:86928"
<http://purl.obolibrary.org/obo/CL_0002531>	"A mature CD1a-positive dermal dendritic cell is CD80-high, CD83-positive, CD86-high, and MHCII-high."	
<http://purl.obolibrary.org/obo/CL_0000387>		"FBbt:00005063"
<http://purl.obolibrary.org/obo/CL_0002530>	"An immature CD1a-positive dermal dendritic cell is CD80-low, CD86-low, and MHCII-low."	
<http://purl.obolibrary.org/obo/CL_1000507>		"KUPO:0001020"
<http://purl.obolibrary.org/obo/CL_0000418>	"An epithelial cell found in C. elegans that firmly hold the outer body wall and the lips to the inner cylinder of the pharynx in a manner that keeps these organs from breaking apart, while still giving each organ freedom of movement during feeding."	"WBbt:0005793"
<http://purl.obolibrary.org/obo/CL_0000915>	"An alpha-beta intraepithelial T cell with the phenotype CD8-alpha-alpha-positive located in the columnar epithelium of the gastrointestinal tract. These cells have a memory phenotype of CD2-negative and CD5-negative."	
<http://purl.obolibrary.org/obo/CL_0002489>	"A thymocyte that lacks expression of CD4 and CD8."	
<http://purl.obolibrary.org/obo/CL_0002600>	"A smooth muscle cell of the trachea."	
<http://purl.obolibrary.org/obo/CL_0000266>	"Obsolete. Use PO:0004011 from Plant Ontology instead. A cell constituting an active locus of meristematic activity in a tissue composed of somewhat older, differentiating cells."	
<http://purl.obolibrary.org/obo/CL_0000414>	"OBSOLETE: A classification of cells by the number of haploid genome equivalents of their nucleus or nuclei."	
<http://purl.obolibrary.org/obo/CL_0008000>	"Any muscle cell in which the fibers are not organised into sarcomeres."	
<http://purl.obolibrary.org/obo/CL_0007006>	"Mesodermal cell that is axially located and gives rise to the cells of the notochord."	
<http://purl.obolibrary.org/obo/CL_2000082>	"Any melanocyte of skin that is part of a skin of prepuce of penis."	
<http://purl.obolibrary.org/obo/CL_0002483>	"A melanocyte that produces pigment within the hair follicle."	
<http://purl.obolibrary.org/obo/CL_0002510>	"A langerin-positive lymph node dendritic cell that is CD103-negative and CD11b-high."	
<http://purl.obolibrary.org/obo/CL_0002152>	"A columnar cell of the cervix uteri."	"FMA:86486"
<http://purl.obolibrary.org/obo/CL_0002648>	"An ecto-epithelial cell of the nasal region of the viscerocranial mucosa."	"FMA:70554"
<http://purl.obolibrary.org/obo/CL_0002147>	"A chief cell of parathyroid glands that does not stain with hematoxylin or eosin. This cell is larger, has a larger nucleus and fewer secretory granules than dark chief cells."	"FMA:69081"
<http://purl.obolibrary.org/obo/CL_1000415>	"An epithelial cell that is part of the gallbladder."	"FMA:67780"
<http://purl.obolibrary.org/obo/CL_0000168>		"BTO:0000783"
<http://purl.obolibrary.org/obo/CL_1001593>	"Glandular cell of parathyroid epithelium. Example: Parathyroid chief cell and parathyroid oxyphil cells."	"CALOHA:TS-1279"
<http://purl.obolibrary.org/obo/CL_0000771>	"Any of the immature or mature forms of a granular leukocyte with a nucleus that usually has two lobes connected by one or more slender threads of chromatin, and cytoplasm containing coarse, round granules that are uniform in size and which can be stained by the dye eosin. Eosinophils are CD9-positive, CD191-positive, and CD193-positive."	"CALOHA:TS-0279 FMA:62861 BTO:0000399"
<http://purl.obolibrary.org/obo/CL_2000095>	"Any hematopoietic stem cell that is part of a umbilical cord blood."	
<http://purl.obolibrary.org/obo/CL_0000205>	"A cellular receptor which mediates the sense of temperature. Thermoreceptor cells in vertebrates are mostly located under the skin. In mammals there are separate types of thermoreceptors for cold and for warmth and pain receptor cells which detect cold or heat extreme enough to cause pain."	
<http://purl.obolibrary.org/obo/CL_0000049>	"A progenitor cell committed to myeloid lineage, including the megakaryocyte and erythroid lineages."	"BTO:0004730"
<http://purl.obolibrary.org/obo/CL_0000253>		
<http://purl.obolibrary.org/obo/CL_0000041>	"A fully differentiated eosinophil, a granular leukocyte with a nucleus that usually has two lobes connected by one or more slender threads, and cytoplasm containing coarse, round granules that are uniform in size and which can be stained by the dye eosin. Cells are also differentiated from other granulocytes by a small nuclear-to-cytoplasm ratio (1:3). This cell type is CD49d-positive."	
