?cls	?def	?xrefs
<http://purl.obolibrary.org/obo/CL_0000163>	"A cell of an endocrine gland, ductless glands that secrete substances which are released directly into the circulation and which influence metabolism and other body functions."	"FMA:83809"
<http://purl.obolibrary.org/obo/CL_0002618>	"An endothelial cell of the umbilical vein."	"BTO:0004296"
<http://purl.obolibrary.org/obo/CL_0000591>	"A thermoreceptor cell that detects reduced temperatures."	
<http://purl.obolibrary.org/obo/CL_0002062>	"A type I pneumocyte is a flattened, branched pneumocyte that covers more than 98% of the alveolar surface. This large cell has thin (50-100 nm) cytoplasmic extensions to form the air-blood barrier essential for normal gas exchange."	"FMA:62500 BTO:0000780"
<http://purl.obolibrary.org/obo/CL_0002402>	"A resting mature B cell within the Peyer's patch that is CD19-positive, B220-positive, IgM-positive, AA4-negative, CD23-positive, CD43-negative, and CD5-negative."	
<http://purl.obolibrary.org/obo/CL_0000269>		
<http://purl.obolibrary.org/obo/CL_0000354>		"ncithesaurus:Blastemal_Cell"
<http://purl.obolibrary.org/obo/CL_2000011>	"Any endothelial cell of lymphatic vessel that is part of a dermis."	
<http://purl.obolibrary.org/obo/CL_1000434>	"An epithelial cell that is part of the external acoustic meatus."	"FMA:70555"
<http://purl.obolibrary.org/obo/CL_0002358>	"Derived from the Greek word pyren (the pit of a stone fruit), this is a transient nucleated cell type that results from exclusion of the nucleus from the primitive erythrocyte."	
<http://purl.obolibrary.org/obo/CL_0002271>	"A type EC enteredocrine cell in the intestines that stores and secretes substance P and 5-hydroxytryptamine."	"FMA:62940"
<http://purl.obolibrary.org/obo/CL_0000297>	"Obsolete. Use PO:0000115 from Plant Ontology instead. A cell that surrounds a trichome and provides support for the trichome."	
<http://purl.obolibrary.org/obo/CL_0000374>	"An epidermal cell that is part of a cell cluster organ of the insect integument (such as a sensillum) and that secretes a cuticular specialization, often in the form of a hair, bristle, peg or scale. The base of this specialization is often surrounded by a socket produced by a closely associated tormogen cell."	"FBbt:00005169 BTO:0004744"
<http://purl.obolibrary.org/obo/CL_0001061>	"A cell found in an organism or derived from an organism exhibiting a phenotype that deviates from the expected phenotype of any native cell type of that organism. Abnormal cells are typically found in disease states or disease models."	"https://ncit.nci.nih.gov/ncitbrowser/ConceptReport.jsp?dictionary=NCI_Thesaurus&code=C12913"
<http://purl.obolibrary.org/obo/CL_0002293>	"An epithelial cell of the thymus. Epithelial reticular cells are pleomorphic, stellate, non-phagocytic cells which seem to be supportive in function and are held together by desmosomes. They replace the fibroblastoid reticular cells found in other lymphoid organs. Other epithelial cells in the medulla have the ultrastructure of secretory cells. Although different epithelial cells throughout the thymus appear alike by light microscopy their ultrastructure and function varies."	"CALOHA:TS-1040 FMA:72208"
<http://purl.obolibrary.org/obo/CL_1000470>	"A myoepithelial cell that is part of the primary lactiferous duct."	"FMA:74500"
<http://purl.obolibrary.org/obo/CL_0000895>	"An antigen inexperienced CD4-positive, alpha-beta T cell with the phenotype CCR7-positive, CD127-positive and CD62L-positive. This cell type develops in the thymus. This cell type is also described as being CD25-negative, CD62L-high, and CD44-low."	
<http://purl.obolibrary.org/obo/CL_0002026>	"A megakaryocyte progenitor cell that is CD34-negative, CD41-positive and CD42-positive."	
<http://purl.obolibrary.org/obo/CL_0002492>	"A polarized columnar cell that covesr the lateral surface of the cochlear duct, secretes potassium ions and forms a continuous sheet in contact with the endolymph; marginal cells form extensive interdigitations with the basal and intermediate cells in the normal adult stria."	
<http://purl.obolibrary.org/obo/CL_0000179>		
<http://purl.obolibrary.org/obo/CL_0000581>	"A macrophage resident in the peritoneum under non-inflammatory conditions. Markers include F4/80-high, CD11b-high, CD68-positive, SIGNR1-positive, CD115-high, MHC-II-negative, and Dectin-1-positive."	"FMA:83025 BTO:0001034"
<http://purl.obolibrary.org/obo/CL_1000405>	"An epithelial cell that is part of the appendix."	"FMA:63602"
<http://purl.obolibrary.org/obo/CL_2000089>	"The principal cell type of the dentate gyrus."	
<http://purl.obolibrary.org/obo/CL_0000131>		
<http://purl.obolibrary.org/obo/CL_0000437>	"A rounded cell that is usually situated next to sinusoids; secretes follicular stimulating hormone (FSH) and luteinizing hormone (LH)."	"BTO:0002482 FMA:83100"
<http://purl.obolibrary.org/obo/CL_0000397>		
<http://purl.obolibrary.org/obo/CL_0000961>	"A follicular B cell that is IgD-positive, CD23-negative, and CD38-negative. This naive cell type is activated in the extrafollicular areas through interaction with interdigitating dendritic cells and antigen-specific CD4-positive T cells."	
<http://purl.obolibrary.org/obo/CL_0002259>	"The stem cell from which glial precursor cell arises from."	"FMA:87171"
<http://purl.obolibrary.org/obo/CL_0002680>	"A PP cell found in intestine."	
<http://purl.obolibrary.org/obo/CL_0000528>	"A nerve cell where transmission is mediated by nitric oxide."	"FMA:84792"
<http://purl.obolibrary.org/obo/CL_1000606>		"KUPO:0001015"
<http://purl.obolibrary.org/obo/CL_0002594>	"A smooth muscle cell of the umbilical artery."	
<http://purl.obolibrary.org/obo/CL_0002619>	"An adult angioblastic cell released from the bone marrow, capable of blood circulation and participation in angiogenesis by differentiating into blood vessel endothelial cells. Their existence is controversial."	
<http://purl.obolibrary.org/obo/CL_1000371>	"A transitional myocyte that is part of the right branch of atrioventricular bundle."	"FMA:263172"
<http://purl.obolibrary.org/obo/CL_0000709>		
<http://purl.obolibrary.org/obo/CL_2000038>	"Any neuromast mantle cell that is part of a posterior lateral line."	
<http://purl.obolibrary.org/obo/CL_0002149>	"An epithelial cell of the uterus."	"FMA:256161"
<http://purl.obolibrary.org/obo/CL_1000307>	"A fibroblast that is part of the dense regular elastic tissue."	"FMA:261287"
<http://purl.obolibrary.org/obo/CL_0002583>	"A preadipocyte that is part of subcutaneous tissue."	
<http://purl.obolibrary.org/obo/CL_0000337>	"An embryonic cell that develops into a nerve cell or neuron."	
<http://purl.obolibrary.org/obo/CL_0002136>	"A cell in the zona fasciculata that produce glucocorticoids, e.g cortisol."	"FMA:69547"
<http://purl.obolibrary.org/obo/CL_0000130>		
<http://purl.obolibrary.org/obo/CL_0002522>	"A renal filtration cell is a specialized cell of the renal system that filter fluids by charge, size or both."	
<http://purl.obolibrary.org/obo/CL_0000396>		"FBbt:00001687"
<http://purl.obolibrary.org/obo/CL_0000263>		
<http://purl.obolibrary.org/obo/CL_0000503>	"A flattened stroma cell forming a sheath or theca outside the basal lamina lining the mature ovarian follicle. Thecal interstitial or stromal cells are steroidogenic, and produce primarily androgens which serve as precusors of estrogens in the granulosa cells."	"FMA:18690 BTO:0002850"
<http://purl.obolibrary.org/obo/CL_1000344>	"A Paneth cell that is part of the epithelium proper of small intestine."	"FMA:263106"
<http://purl.obolibrary.org/obo/CL_1001602>	"Endothelial cells forming the walls of the capillaries within the cerebral cortex."	"CALOHA:TS-2372"
<http://purl.obolibrary.org/obo/CL_1000290>	"A muscle cell that is part of the middle internodal tract."	"FMA:223279"
<http://purl.obolibrary.org/obo/CL_0002338>	"A natural killer cell that is developmentally immature, has the phenotype CD34-negative, CD56-negative, CD117-positive, CD122-positive,and CD161-positive."	
<http://purl.obolibrary.org/obo/CL_2000030>	"Any native cell that is part of a hypothalamus."	
<http://purl.obolibrary.org/obo/CL_0000001>	"A cultured cell that is freshly isolated from a organismal source, or derives in culture from such a cell prior to the culture being passaged."	"BTO:0002290"
<http://purl.obolibrary.org/obo/CL_1001142>		"KUPO:0001085"
<http://purl.obolibrary.org/obo/CL_0001069>	"An innate lymphoid cell that is capable of producing T-helper 2-cell associated cytokines upon stimulation."	
<http://purl.obolibrary.org/obo/CL_0000827>	"A lymphoid progenitor cell of the T cell lineage, with some lineage specific marker expression, but not yet fully committed to the T cell lineage."	
<http://purl.obolibrary.org/obo/CL_1000368>	"A transitional myocyte that is part of the anterior division of left branch of atrioventricular bundle."	"FMA:263166"
<http://purl.obolibrary.org/obo/CL_0000113>	"A vertebrate phagocyte with a single nucleus."	"BTO:0001433"
<http://purl.obolibrary.org/obo/CL_0000284>	"Obsolete. Use PO:0000071 from Plant Ontology instead. A specialized parenchyma cell associated with a sieve-tube member in angiosperm phloem and arising from the same mother cell as the sieve-tube member."	
<http://purl.obolibrary.org/obo/CL_0002416>	"A Vgamma1.1-positive, Vdelta6.3-positive thymocyte that is CD24-negative."	
<http://purl.obolibrary.org/obo/CL_0000003>	"A cell that is found in a natural setting, which includes multicellular organism cells 'in vivo' (i.e. part of an organism), and unicellular organisms 'in environment' (i.e. part of a natural environment)."	"CARO:0000013"
<http://purl.obolibrary.org/obo/CL_0000215>	"A cell whose primary function is to prevent the transport of stuff across compartments."	
<http://purl.obolibrary.org/obo/CL_0001054>	"A monocyte that expresses CD14 and is negative for the lineage markers CD3, CD19, and CD20."	
<http://purl.obolibrary.org/obo/CL_0002539>	"A smooth muscle cell of the aorta."	"BTO:0004577"
<http://purl.obolibrary.org/obo/CL_0000971>	"An IgM memory B cell is an unswitched memory B cell with the phenotype IgM-positive and IgD-negative."	
<http://purl.obolibrary.org/obo/CL_0000322>	"An epithelial cell that lines the peripheral gas exchange region of the lungs of air-breathing vertebrates."	"FMA:62499 CALOHA:TS-2168 BTO:0000395"
<http://purl.obolibrary.org/obo/CL_0002134>	"A stromal cell of the ovarian medulla."	"FMA:256171"
<http://purl.obolibrary.org/obo/CL_1001576>	"Squamous cell of oral epithelium."	"CALOHA:TS-1252"
<http://purl.obolibrary.org/obo/CL_0000276>	"Obsolete. Use PO:0000077 from Plant Ontology instead. Cell variable in form and size, being more or less thick, often lignified, secondary walls. Belongs to the category of subcells and may or may not be devoid of protoplast at maturity."	
<http://purl.obolibrary.org/obo/CL_0000527>	"A neuron which sends impulses peripherally to activate muscles or secretory cells."	
<http://purl.obolibrary.org/obo/CL_0000576>	"Myeloid mononuclear recirculating leukocyte that can act as a precursor of tissue macrophages, osteoclasts and some populations of tissue dendritic cells."	"FMA:62864 BTO:0000876 CALOHA:TS-0638"
<http://purl.obolibrary.org/obo/CL_0001021>	"A common lymphoid progenitor that is CD10-positive, CD45RA-positive, CD34-positive and CD38-positive."	
<http://purl.obolibrary.org/obo/CL_0011107>	"Astrocyte-like radial glial cell that extends vertically throughout the retina, with the nucleus are usually in the middle of the inner nuclear layer."	
<http://purl.obolibrary.org/obo/CL_0002021>	"An enucleate erythrocyte that is GlyA-positive."	
<http://purl.obolibrary.org/obo/CL_0011004>	"A vetebrate lens cell that is any of the elongated, tightly packed cells that make up the bulk of the mature lens in a camera-type eye."	
<http://purl.obolibrary.org/obo/CL_0002626>	"An immature astrocyte."	
<http://purl.obolibrary.org/obo/CL_0000876>	"A splenic macrophage found in the white pulp of the spleen. Markers include F4/80-negative, CD68-positive, and macrosialin-positive."	
<http://purl.obolibrary.org/obo/CL_0000791>	"A alpha-beta T cell that has a mature phenotype."	
<http://purl.obolibrary.org/obo/CL_2000096>	"Any fibroblast that is part of a reticular layer of dermis."	
<http://purl.obolibrary.org/obo/CL_0002505>	"A CD11b-positive dendritic cell that is CD11b-high, CD45-positive, MHC-II-positive and CD103-negative."	
<http://purl.obolibrary.org/obo/CL_0000350>		
<http://purl.obolibrary.org/obo/CL_1001591>	"Glandular cell of oviduct epithelium. Example: peg cells, ciliated cells."	"CALOHA:TS-1277"
<http://purl.obolibrary.org/obo/CL_0000984>	"A plasmablast that secretes IgA."	
<http://purl.obolibrary.org/obo/CL_0000601>	"A mechanoreceptor in the organ of Corti. In mammals the outer hair cells are arranged in three rows which are further from the modiolus than the single row of inner hair cells. The motile properties of the outer hair cells may contribute actively to tuning the sensitivity and frequency selectivity of the cochlea."	"FMA:62366 BTO:0003666"
<http://purl.obolibrary.org/obo/CL_0002326>	"A mammary epithelial cell that occurs in the lumen of the ductal and alveoli structure in the breast."	"FMA:73280"
<http://purl.obolibrary.org/obo/CL_0000659>	"An extracellular matrix secreting cell that secretes eggshell."	
<http://purl.obolibrary.org/obo/CL_0008008>	"A visceral muscle cell that is striated.  Examples include the visceral muscle cells of arhtropods."	
<http://purl.obolibrary.org/obo/CL_0000398>		"FBbt:00001691"
<http://purl.obolibrary.org/obo/CL_0000265>		
<http://purl.obolibrary.org/obo/CL_0002174>	"A cell within the follicle of an ovary."	"FMA:70589 EMAPA:31247"
<http://purl.obolibrary.org/obo/CL_0002334>	"An undifferentiated fibroblast that can be stimulated to form a fat cell."	"BTO:0001107"
<http://purl.obolibrary.org/obo/CL_0002620>	"A fibroblast of skin."	"CALOHA:TS-0935 BTO:0001255"
<http://purl.obolibrary.org/obo/CL_1000409>	"A muscle cell that is part of the sinoatrial node."	"FMA:67102"
<http://purl.obolibrary.org/obo/CL_1000432>	"An epithelial cell that is part of the conjunctiva."	"FMA:70552"
<http://purl.obolibrary.org/obo/CL_0011108>	"Epithelial cell that is part of the colon epithelium."	
<http://purl.obolibrary.org/obo/CL_0000531>		
<http://purl.obolibrary.org/obo/CL_0000920>	"CD8-positive, alpha-beta positive regulatory T cell with the phenotype CD28-negative and FoxP3-positive."	
<http://purl.obolibrary.org/obo/CL_0002469>	"Gr1-high monocyte that lacks MHC-II receptor complex."	
<http://purl.obolibrary.org/obo/CL_0000710>	"Epithelial cells derived from neural plate and neural crest."	"FMA:70557 BTO:0004301"
<http://purl.obolibrary.org/obo/CL_0002287>	"A rounded, mitotically active stem cell which is the source of new cells of the taste bud; located basally."	"FMA:62380"
<http://purl.obolibrary.org/obo/CL_0000664>		
<http://purl.obolibrary.org/obo/CL_0002164>	"A rod-shaped cell found in 3 or 4 rows that lie adjacent to and support the outer hair cells."	"FMA:75727"
<http://purl.obolibrary.org/obo/CL_0000579>		"FBbt:00004905"
<http://purl.obolibrary.org/obo/CL_0002397>	"A CD14-positive monocyte that is also CD16-positive and CCR2-negative."	
<http://purl.obolibrary.org/obo/CL_0000656>	"A diploid cell that has derived from a spermatogonium and can subsequently begin meiosis and divide into two haploid secondary spermatocytes."	"FMA:72292 CALOHA:TS-2194 BTO:0001115"
<http://purl.obolibrary.org/obo/CL_0000065>	"A neurectoderm derived cell that lines the neural lumen."	"FMA:70550 BTO:0001724"
<http://purl.obolibrary.org/obo/CL_0000454>	"A cell capable of producing epinephrine. Epiniphrine is synthesized from norepiniphrine by the actions of the phenylethanolamine N-methyltransferase enzyme, which is expressed in the adrenal glands, androgenic neurons, and in other cell types."	
<http://purl.obolibrary.org/obo/CL_0000748>	"A bipolar neuron found in the retina and having connections with photoreceptors cells and neurons in the inner plexiform layer."	
<http://purl.obolibrary.org/obo/CL_0000630>	"A cell whose primary function is to support other cell types."	"BTO:0002315"
<http://purl.obolibrary.org/obo/CL_0002366>	"A smooth muscle cell of the myometrium that enlarges and stretches during pregnancy, and contracts in response to oxytocin."	"BTO:0004519"
<http://purl.obolibrary.org/obo/CL_0000160>	"A cell of the epithelial lining that produce and secrete mucins."	"http://en.wikipedia.org/wiki/Goblet_cell FMA:13148 BTO:0001540"
<http://purl.obolibrary.org/obo/CL_1001106>		"KUPO:0001049"
<http://purl.obolibrary.org/obo/CL_0002577>	"An epithelial cell of the placenta."	
<http://purl.obolibrary.org/obo/CL_0000703>	"Cell that provides some or all mechanical, nutritional and phagocytic support to their neighbors."	"BTO:0002315"
<http://purl.obolibrary.org/obo/CL_0000445>		
<http://purl.obolibrary.org/obo/CL_1000695>		"KUPO:0001106"
<http://purl.obolibrary.org/obo/CL_0000663>		
<http://purl.obolibrary.org/obo/CL_0000530>		
<http://purl.obolibrary.org/obo/CL_2000028>	"Any glutamatergic neuron that is part of a cerebellum."	
<http://purl.obolibrary.org/obo/CL_0000746>	"Cardiac muscle cells are striated muscle cells that are responsible for heart contraction. In mammals, the contractile fiber resembles those of skeletal muscle but are only one third as large in diameter, are richer in sarcoplasm, and contain centrally located instead of peripheral nuclei."	"BTO:0001539 CALOHA:TS-0115 FMA:14067"
<http://purl.obolibrary.org/obo/CL_0002341>	"An undifferentiated cell of the prostate epithelium that lacks secretory activity."	
<http://purl.obolibrary.org/obo/CL_0002217>	"A trophoblast that leaves the placenta and invades the endometrium and myometrium. This cell type is crucial in increasing blood flow to the fetus."	"FMA:86564 BTO:0002366"
<http://purl.obolibrary.org/obo/CL_0000227>		
<http://purl.obolibrary.org/obo/CL_0001043>	"A recently activated CD4-positive, alpha-beta T cell with the phenotype HLA-DRA-positive, CD38-positive, CD69-positive, CD62L-negative, CD127-negative, and CD25-positive."	
<http://purl.obolibrary.org/obo/CL_0008022>	"A mesenchymal cell of the endocardial cushion.   These cells develop via an epithelial to mesenchymal transition when endocardial cells break cell-to-cell contacts and migrate into the cardiac jelly. Cells from this population form the heart septa and valves."	
<http://purl.obolibrary.org/obo/CL_0001041>	"A CD8-positive alpha-beta-positive T cell with the phenotype CXCR3-positive and having suppressor function. They are capable of producing IL-10, suppressing proliferation, and suppressing IFN-gamma production."	
<http://purl.obolibrary.org/obo/CL_0000913>	"CD8-positive, alpha-beta memory T cell with the phenotype CCR7-negative, CD127-positive, CD45RA-negative, CD45RO-positive, and CD25-negative."	
<http://purl.obolibrary.org/obo/CL_1000367>	"A transitional myocyte that is part of the posterior internodal tract."	"FMA:263164"
<http://purl.obolibrary.org/obo/CL_0002215>	"A type II muscle cell that contains a low content of myoglobin, relatively few mitochondria, relatively few blood capillaries and large amounts of glycogen. Type II B fibres are white, geared to generate ATP by anaerobic metabolic processes, not able to supply skeletal muscle fibres continuously with sufficient ATP, fatigue easily, split ATP at a fast rate and have a fast contraction velocity."	"FMA:84416"
<http://purl.obolibrary.org/obo/CL_2000078>	"Any pericyte cell that is part of a placenta."	
<http://purl.obolibrary.org/obo/CL_0002219>	"A trophoblast found at the junction of the placenta. This cell type makes a unique fibronectin-trophouteronectin junction that helps mediate attachment of the placenta to the uterus. This cell type is also found junction of the chorion layer of the external membranes and the decidua."	
<http://purl.obolibrary.org/obo/CL_1000123>		
<http://purl.obolibrary.org/obo/CL_0000570>	"A neuroepithelial cells that occurs singly or in small groups, close to the outer follicular borders but within the follicular basement membrane of the thyroid. Expresses a form of the neural cell adhesion molecule (N-CAM) on their surface. Secretes calcitonin, 5-hydroxytryptamine and dopamine."	"FMA:68653 SCTID:176770005"
<http://purl.obolibrary.org/obo/CL_0000533>		"FMA:83619"
<http://purl.obolibrary.org/obo/CL_1000356>	"A M cell that is part of the epithelium proper of duodenum."	"FMA:263134"
<http://purl.obolibrary.org/obo/CL_1000692>		"KUPO:0001102"
<http://purl.obolibrary.org/obo/CL_1000456>	"A mesothelial cell that is part of the parietal peritoneum."	"FMA:72142"
<http://purl.obolibrary.org/obo/CL_0000666>		
<http://purl.obolibrary.org/obo/CL_0001017>	"Mature CD1a-positive Langerhans cell is a CD1a-positive Langerhans cell that is CD80-high, CD86-high, MHCII-high and is CD83-positive."	
<http://purl.obolibrary.org/obo/CL_0000554>	"A peptide hormone secreting cell that secretes gastrin stimulating hormone."	
<http://purl.obolibrary.org/obo/CL_0007020>	"Characteristic early embryonic cell with a bottle or flask shape that is first to migrate inwards at the blastopore during gastrulation in amphibians."	
<http://purl.obolibrary.org/obo/CL_1000469>	"A myoepithelial cell that is part of the main lactiferous duct."	"FMA:74499"
<http://purl.obolibrary.org/obo/CL_0002545>	"An endothelial cell that is part of the thoracic endothelium."	
<http://purl.obolibrary.org/obo/CL_1001608>	"Fibroblast from foreskin."	"CALOHA:TS-0384"
<http://purl.obolibrary.org/obo/CL_0005021>	"Mesenchymal derived lymphatic progenitor cells that give rise to the superficial lymphatics."	
<http://purl.obolibrary.org/obo/CL_0001024>	"CD133-positive hematopoietic stem cell is a hematopoietic stem cell that is CD34-positive, CD90-positive, and CD133-positive."	"CALOHA:TS-0448 FMA:86475"
<http://purl.obolibrary.org/obo/CL_2000094>	"Any epithelial cell of viscerocranial mucosa that is part of a nasal cavity respiratory epithelium."	
<http://purl.obolibrary.org/obo/CL_0000129>	"A central nervous system macrophage found in the parenchyma of the central nervous system. Marker include CD11b-positive, F4/80-positive, and CD68-positive."	"BTO:0000962 FMA:54540 BTO:0000078 FMA:54539"
<http://purl.obolibrary.org/obo/CL_0000818>	"An immature B cell of an intermediate stage between the pre-B cell stage and the mature naive stage with the phenotype surface IgM-positive and CD19-positive, and are subject to the process of B cell selection. A transitional B cell migrates from the bone marrow into the peripheral circulation, and then to the spleen."	
<http://purl.obolibrary.org/obo/CL_1000693>		"KUPO:0001103"
<http://purl.obolibrary.org/obo/CL_0000532>		
<http://purl.obolibrary.org/obo/CL_1000191>	"A rod-like cell in the inner ear, having their heads joined and their bases on the basilar membrane widely separated so as to form a spiral tunnel known as the tunnel of Corti."	"FMA:75722"
<http://purl.obolibrary.org/obo/CL_0002578>	"A preadipocyte found in mesenteric tissue."	
<http://purl.obolibrary.org/obo/CL_0000314>		
<http://purl.obolibrary.org/obo/CL_0002568>	"A mesenchymal stem cell that is part of Wharton's jelly."	
<http://purl.obolibrary.org/obo/CL_1000482>	"A myocardial endocrine cell that is part of the interventricular septum."	"FMA:83390"
<http://purl.obolibrary.org/obo/CL_0000479>	"A peptide hormone secreting cell that secretes vasopressin stimulating hormone"	
<http://purl.obolibrary.org/obo/CL_0002466>	"A CD11b-positive dendritic cell located in the serosal portion of the small intestine epithelium. This cell type is CD45-positive, MHC-II-positive, CD11c-low, CD103-negative."	
<http://purl.obolibrary.org/obo/CL_0000665>		
<http://purl.obolibrary.org/obo/CL_0002535>	"An epithelial cell of the cervix."	
<http://purl.obolibrary.org/obo/CL_0011013>	"A sperm cell that is cabaple of motion (motility)."	
<http://purl.obolibrary.org/obo/CL_0002045>	"A pro-B cell that CD45R/B220-positive, CD43-positive, HSA-low, BP-1-negative and Ly6c-negative. This cell type is also described as being lin-negative, AA4-positive, Kit-positive, IL7Ra-positive and CD45R-positive."	
<http://purl.obolibrary.org/obo/CL_0002638>	"A respiratory stem cell found at the junction of the terminal (conductive) bronchiole and the respiratory bronchiole. This cell types gives rise to alveolar cell types and club cells in response to lung injury. This cell type expresses markers Scgb1a1 and Sftpc."	
<http://purl.obolibrary.org/obo/CL_0002011>	"A progenitor cell that can give rise to plasmacytoid and myeloid dendritic cells, and to monocytes and macrophages. Marker for this cell is Kit-high, CD115-positive, CD135-positive, Cx3cr1-positive, and is Il7ra-negative."	
<http://purl.obolibrary.org/obo/CL_0002179>	"An epithelial cell within one of the pits in the embryonic gastric mucosa from which the gastric glands develop ."	"FMA:86552"
<http://purl.obolibrary.org/obo/CL_0000447>		
<http://purl.obolibrary.org/obo/CL_0000940>	"An alpha-beta T cell that is found in the lamina propria of mucosal tissues and is restricted by the MR-1 molecule."	
<http://purl.obolibrary.org/obo/CL_0002111>	"An CD38-negative unswitched memory B cell is an unswitched memory B cell that has the phenotype CD38-negative, IgD-positive, CD138-negative, and IgG-negative."	
<http://purl.obolibrary.org/obo/CL_0002541>	"A mesenchymal stem cell of the chorionic membrane."	
<http://purl.obolibrary.org/obo/CL_0002346>	"An immature natural killer cell that is NK1.1-positive and DX-5 negative."	
<http://purl.obolibrary.org/obo/CL_0000145>	"A cell capable of processing and presenting lipid and protein antigens to T cells in order to initiate an immune response."	
<http://purl.obolibrary.org/obo/CL_0005004>	"A non-terminally differentiated cell that originates from the neural crest and differentiates into an erythrophore."	
